Title_ar,Title_english,Title_ar,Artist,year,Song_url,image_url,cleaned_lyrics,Num_words
 عادي فشخ ,3adi Fash5 , عادي فشخ ,Marwan pablo, 2016,https://genius.com/Marwan-pablo-3adi-fash5-lyrics,https://images.genius.com/851c4fd260fad7b7e457e0f631ae84fd.1000x1000x1.png, عادي فشخ فشخ تدي ايحاء روش فشخ حياتي ممله مسخ مفيش ابتكار اصلاً عايش نسخ نسخه مستنسخ مستنسخين كلامي عباره نزيف شرجي تخين مطرطش حيطان راسم بدم مدبوح ميت غرقان حلمه طموح فتحها عافيه يتوف قفلها ببوقه وغير مدينه مدينه نمره هتيجي فقره فقره جابت اخري بتمثل دور طاهره مش لايق مش لايقه بيحوش فلوس يجيب بوكيه صبار ميت مش هتحتاج تسقيه عطشان اصلاً لسه رميه بتاعي فاصل عاده تاني بفك دماغي واطلع معاني راجع كويس احسن تفهم لوحدك شرح مطول دراعي حيطه وسقفي هبقي غش Beat بار Refresh اهوش تكش اشوش دماغك ونقطع دش ابلك تجف ازفك تخف عينك وعينك ترف اطحنلك مزيكا تقعد تسف دمي رمله دود بيلف لساني فضاءها ولو غيري تتف متسربعه تقلي وبتقولي خف اعطسكوا وانف بختلف معرفش ابقي عرص لازم اعترف,127
 عالم إفتراضي ,3alam Eftradi , عالم إفتراضي ,Marwan pablo,2016,https://genius.com/Marwan-pablo-3alam-eftradi-lyrics,https://images.genius.com/851c4fd260fad7b7e457e0f631ae84fd.1000x1000x1.png, بنام وبصحي اوضه اصغر دماغي عايش مكتءب افتراضي وصفها مفروض فاهماني حقيقه بكدب لسه مقابلتش جزءي تاني بيقولوا مش بفهم ادبي فتحت سوسته بنطلوني ووريتهم ادبي حاجتين حمام بشخهم واعمل انجاز ودي اكل باكله كلام ناس موسيقي  داما بيشم مخدرات مقطع تاني دماغي بتسيح محاط احباط قولولي حاجه افهمها شايل وداني شفاط بكلم نفسي ماكلنا مرضي متخافش مش جلطه باصين ارض اعترافي بمشاعري غلطه اعمل نفسك مهتم اعمل نفسك بتعيش دور بوكيه ورد نص حاره وشي ديكور بحفر حديد بشوكه بخزق عينك ازاز بكره بشر فاكيد ربي مش انسان,89
 عايز فين ,3ayz Fin , عايز فين ,Marwan pablo, 2018,https://genius.com/Marwan-pablo-3ayz-fin-lyrics,https://images.genius.com/a23f757b37fb5fe02440d71ebffd43f1.1000x1000x1.png, Ok WoohWoWo فاكر وريهم بقي عايز فين بقت بتدوس بتفوز كلام مش بفلوس عايز فين تنفعش تبقي زميل بتحرق جاز كتير عرفتش برضه عايز فين بقت اعلام بتشيل وتنام بشر بلسان اهتم بيبان شغله مش هتبات ووه دُغري مافيش مجاملات ووه كاريزما انور سادات  ووه قولي عايز فين Beat تع نقدرها Maratho بجري حكومه بتطاردني فيكوا شاغلني بيشغلنيش وما بيشغلنيش اشباح جان كافه هتلف ميزان بظبط اداء oh Gucci Gucci Gucci Ga gومش ب بستشلحكوا كلام حطيتهملك مزاد حدش هيدفع قرش ساغ صاحبي بنسخن مناخ Beatب Milly Rock ومش ب Dap Beat روحي  Trap خلاص قربت اكون ه ونجوم ليل مقدوري اشلفلك عايش متربصلي مش هتسلك مش هتسلك فبلاش تشب هتفضل مش طايل وضع طيران ياريت ترنش موبايل صاحبي بنسعي صاير تضحكليش وشي بوشين ملك غيري تبقي بدعه اكلت جو مافيش فايض عايز مني حبه قولي,136
 عزبة الجامع ,3Ezbt El Game3 , عزبة الجامع ,Marwan pablo, 2018,https://genius.com/Marwan-pablo-3ezbt-el-game3-lyrics,https://images.genius.com/cfd65e509e58dff1e6ba429f93bab6ea.1000x1000x1.png, خلاص بطلت صحبه بتجمع حشيش خلاص بطلت صحبه بتجمع حشيش خلاص بطلت صحبه بتجمع حشيش ومايشغلنيش خلاص بطلت صحبه بتجمع حشيش خلاص بطلت صحبه بتجمع حشيش خلاص بطلت صحبه بتجمع حشيش ومايشغلنيش دماغنا اتكلفت تراب لعبتنا شباب منا اتعلمت اساتذه مبلم عملت ناس شيء ندل متلومش مايشغلنيش بطلت صحبه بتجمع حشيش مجليش صعب ماديش هديك ازميلي نصيحه متحولنيش صاحبي مش بهبد قلبت دنيا مرمي وعم اسدد ومش متبت نولعوها عز برد قارص صاحبي شوف لعب مكشوف حضرت جن قلبت واقع طرابزين وهتلاقيهم فوقك طريقك نازل ازميلي بيسوقاك بيسوقاك,88
 خفافيش ,5afafish , خفافيش ,Marwan pablo,2016,https://genius.com/Marwan-pablo-5afafish-lyrics,https://images.genius.com/851c4fd260fad7b7e457e0f631ae84fd.1000x1000x1.png, احتكار بجري تتار كلامي ناسبك هيلففك بحار مزيكا عامل انصهار كلام كرتون ليل نهار دماغي فانتازيا فشخ  يش انتحار طرزان غابه يبقي اكيد فضا مافيش كلام اكيد طز يكره اكون سعيد لساني ترامبولين بسلك شايك مشنوقين فرحان بتعامل صافي ناس وسخه اعترافي ضغط باشرافي بنلعب اضافي عايم بحر ارانب حاسس قرصان Beatبكسر  Roof وابني طحوله قطط وجبه تونه مستبيع راسي لرجلي جينا قبليك بقينا ستار جينا جنبيك عملنا حصار دماغي شغ زرار بقف تاني بقف تاني فكيت مزامنه ورحت تاني شتمته رماني شغلت اغاني فتحت تلاجه وده شدني بصطبح ليل فتحس دماغي خفافيش بتنونو راسم حيطه  عندي فلوهات كتير مستودع مش لازم اقول توكيل احراج زور ومفك مخه مقفول اوضتي راس واحده جوه صندوق بتغني,115
 حين ميسرة ,7een Maysara , حين ميسرة ,Marwan pablo, 2022,https://genius.com/Molotof-7een-maysara-lyrics,https://images.genius.com/c3bb0b8223af72f335355ea363fba103.1000x1000x1.png, Yeah Yeah yeah Yeah مكتوب نصنع مجد نصنع مجد دور We started baseme ناس بتشوف فرق ناس بتشوف فرق ناس بتشوف فرق فوق زميلي دوخه بدون كوكا تيجي نثبت صنم فوق ازميلي دوخه كاني سمسم Beat حط Emoji خوخه Preachانا مش جاي Moral جاي اقول لازمه وحش شاشه باقي فطش نازل لطش ماتش Royal Rumble بتغاشم افكرش Ive bee dri ki g much Ive bee goi g far اتكون عندي طاقه معرفش اسمها Beatابعتلها Message نظام اخد طلقه لمولوتوف بقول مش صوت  بشوف مرايتي يوم ياه,86
 أحلى تور ,A7LA TOUR , أحلى تور ,Marwan pablo, 2018,https://genius.com/Obarz-a7la-tour-lyrics,https://images.genius.com/08814305326df62a6c4f9071b15d7bee.1000x563x1.jpg, CAN’T SEE YALL IN4 CAN’T SEE YALL IN THE DARL NEGA6  مروان بابلو ازميلي ناس مش هتشوفنا عادي برا ازميلي مش هشوفهم رافع دماغي  دماغي First class ماشي  okay جرعه تموت ماجي ازنقها تموه عيدلي مبنحرقش بنزين متجيش بقي تفول متجيش بقي تفول متجيش بقي تفول مبنحرقش جاز كتير اسف ازميلي بيدوب كحل وصلت يقيد نور Cool تعمل اسطول مش هنبقي Tour اخدك مجاري نعمل احلي CAN’T SEE YALL IN THE DARL NEGA6 مقطع ثاني OBARZ Thoughts  I’m rude If k ow hommie  I’m cool Looki vibes Positive mi ds Light Light Watch iggas follow Pay igga Is motto Hash came Morroco Got feeli like pablo I zo e pablo Never idol I ru 5 O I try get check Throwi diamo ds eck Moved lotta percsets Cou mo ey double check I ca hear mo ey calli Trappi early mor I dream ori g My life could ever bori g Could ever bori g,155
 أبو مكة ,Abu Mecca , أبو مكة ,Marwan pablo, 2019,https://genius.com/Marwan-pablo-abu-mecca-lyrics,https://images.genius.com/ae0fe1765f560cb8c472d1ef42d5b9ce.1000x1000x1.png, I feel like Tupac eyes Ayy yah Fucki  awesome Yahyah Yeah مافيش دراما Fuck مافيش دراما زميلي وريني ماده عايزين ناكلوا عيش نعملوا فته جايه شام نرقصوا دبكه عارفه هداف ابو مكه  صاحبي شارع بيسلكش سوس عارفين لعبه فيهاش حظوظ BeatWelcome بيك  Lobby مش ناوي دور  هتموت Nigga like Pah Pah Im ru g game Nigga mad Cause were ot same Yeah هتشيط Beatكلها بتحملج  Feat عايز غِني مش صِيت هتقل وده اكيد ياه Beatانت بتبمبك مش  Comeback اسطمبه كاسر لمبه شمبر مش شايف حد اوضه ضلمه بابلو بارع برود بابلو حلو اسود خمسه حسود حصلتوش برود You iggas t k ow shootow WًoaWoa Woa WoaWoa WًoaWoa Woa WoaWoa,109
 افتر بارتي ,After Party , افتر بارتي ,Marwan pablo, 2019,https://genius.com/Amro-awaad-after-party-lyrics,https://images.genius.com/e63bf419966324abcb83b082e68732cc.1000x1000x1.png, اشجار وتلج وميه اصتفات ميه اشجار وتلج وميه اصتفات ميه خد ليك سيب Beat  After Party صباحيه اشجار وتلج وميه اصتفات ميه خد ليك سيب Beat  After Party صباحيه  عمرو عواد اولي اشجار تتلف تانيه تلج يتسف ته ميه تتصب ناسي حاجه متكي عَلي صبر بتاعي ريس حرب راجع ابني مدنكم قصر ملوك انيمكم عصر ملوك لسه قبر Beatحاطت بنها  Map ڤيرزاتي تتلم كتاب ڤيرزاتشي دولاب حاقدين اكتءاب صحاب بقو اغراب احباب ضاعوا سراب بلح يملي عينهم تراب BeatID Royal خراب كلكم عشري ابراهيم مش لءيم غشيم اسفين حبونا كارهين نقرا فاتحه حاقدين ساعه سلام بنحارب ماشي بساعه عقارب فاكرني غايب بنساكم وبفتح ازايز ساعه سلام بنحارب ماشي بساعه عقارب Если ты меня не знаешь Нахои сука сука сука,119
 أهلًا ,Ahlan , أهلًا ,Marwan pablo,2016,https://genius.com/Marwan-pablo-ahlan-lyrics,https://images.genius.com/851c4fd260fad7b7e457e0f631ae84fd.1000x1000x1.png, احلامك مش هتشوفها مغمض عينك ايدك رسمه بتتلون ايدك بسمه وبتلون بيضه غربان معتوه غرك لونها بيضه هتفقس تعبان عايش معلقه فنجان ملعون ابو تفاهم بيجيب صداع حير جلد حيه بشر فاشله اصطناع بحارب ضلمه لوحدي نمت هحلم مفيش نهايه سعيده كوابيسي بتقولك اهلاً مش لاقي كلام اعبر فقدت نطق ذكريات بشوفها كتر ملل ببطء بتشرح نزيف بفرط نضيف اشك مسعوره بقت وباء خنزير بيبص لفوق غباء فاصل دمي اشرب ناموسه هتعمل شوفت عفريته بتلبس عروسه رحبوا بيها قوموا رحبوا بيها مركب مياه انتوا هتولعوا رحبوا بيها بقولكوا رحبوا بيها دنيا مش جنه هنموتوا ايماني موت مش هيبعدوه عني سفري للمجهول قاعد بلون كفني بشوف نور مرعب ابعد بماطل حق مشهد اخوات رصيف يتعاركوا نص رغيف نزلت قاع وشوفت كتير عيون ببصه تجيب تنميل دماغي واقعه مني بير كره زفت فيل تخين هقسم وشه لكرابين فعصت عينيه بايديا عملت بيه سحر حولني غول شرب تور كنتش هقول بموت,148
 أتاري ,Atary , أتاري ,Marwan pablo, 2021,https://genius.com/Marwan-pablo-atary-lyrics,https://images.genius.com/039f42f7c9f1aa0839efd7b94aabdafa.1000x1000x1.png, ناس فوق ناس تحت حاولت كتير ناس فوق ناس تحت بتمشي بتمشي ناس فوق ناس تحت كده هي هي ديب ويب بيبي مجاري بنمارسش رياضه بنجري اتاري خدناها مشي للمدارس خريجين وع عادي قتش لازمه للشهاده هتلاقي فركه بتنادي كلاب جعانه وبرشام دنيا مش ورديه هلفط كلام هيصبح لوحه فنيه وربنا مش بعيد جامع مستنيه هدوم عيد حيله ايد قولي نشكي لمين سنين هتيجي سنين فاتوا بيتعادوا شباب لابسها عفاريت دور حكايه للصيت امه فرش واقف بجيب للبيت بجيب للبيت مص لفيت جمعيه جمعيه بكون نفسي مش عيب فاضلش حاجه جيب فاضلش حاجه جيب يوميتي رايحه بشغلش غيب فقر مليت كبت غنيت,102
 أي زحمة ,Ay Za7ma , أي زحمة ,Marwan pablo,2016,https://genius.com/Marwan-pablo-ay-za7ma-lyrics,https://images.genius.com/851c4fd260fad7b7e457e0f631ae84fd.1000x1000x1.png, زحمه تشوفها هتلاقي صوتها مزعج تيجي تجيب هدايا تبقي منتج كلامي نصه مُربك تشوف ازازه ادب صابعي عينك واقول غلاسه مش كاءن بشوكه وكماشه باكل دبانه وكلامي مش تافه بلعب ڤيڤا مش فاضي اشتم رجعت ريما ومش هتبطل تتمسكن شايل دماغي مش بفتكر زمان معلي مزيكا اخر يابا طز جيران رايق تشوف غروب عينيا عيون بتبص عليا فاصل واقعي مش متشاءم قدرني مش فاهم ع لمبه بشاور ومش مجبر اجاوب فراشه بتطلع ودني شافوها وخافوا عندها خدين تلي عايزين يتباسوا Beat غيرت شعار مبقاش مزيكا Skate طز نوم ولو حبيت احرك كوكب بلاش مب غه عمري ابقي مهتم بفكر برشام بضيع وقتي كلام واسوا احساس نسب تفكر اسوا احساس شنطه اوهام هتبيعها بكام هشتري مزاد هيقولوا بيهيس قشطه بتكلم بغني وعنيا لفوق مش لازم تلعب جمباز تفكر برا صندوق,129
 بربري ,Barbary , بربري ,Marwan pablo, 2022,https://genius.com/Marwan-pablo-barbary-lyrics,https://images.genius.com/f2d96ef484d2299dbb5358b00ee92e6a.1000x1000x1.png, سايق ماني تِكلكعوا اسلِّكم بتضطروني اديكم بتت بلدك دعي عارف صورم صورم واناني نفسك تطلع تيجي مكاني ساحه همجي وبربري تجيش سكه تجيش قدامي تجوش سكه هارشكوا كشاف عينه اتفو وشه دهب اشباهكم قِشرُه تفتح بءك نسكت جندي وربك مخليني فارسهم مِعوِجّه احبش مج سهم راجل دُغري عايز تمن ارقام Beatانا  Top قولي انافسهم فزبه برضه هنسبق نمشوها فرِده مرور وده مش ديس لا شِشنه كلوساب سيجن  بينضفوش نفوسهم عِكره كاتب ليسته يسرق هنسلخوه كَيّشت بكارت فيزا جبت عربيه جديده ومش بابي اداني فلوس,84
 بواكيز ,Bawakiz , بواكيز ,Marwan pablo, 2018,https://genius.com/Ma3azef-bawakiz-lyrics,https://images.genius.com/8e92456722eebfc011bea0235f1055e2.500x500x1.png, Yeah yeah مش هستناكي دماغي فيهاش بواكي حوارات كتير بقيت عداءي قطعت فواتير مخلص ديوني تحاسبنيش طول ربنا سايبني اعيش امجنون اصحي وفوق بتركب بسوق We getti g Bawakiz هتضيعلي وقتي يبقي فاكس بشريه اناكف بشوفها بعرفش ابقي راكز بحب اعداءي مركزين عليهم مش هرد Beatفين  A swer machi e Beatفين  A swer machi e هتقارن بمين Beatمافيش Real بتشيل بتشيل وضعي فتره رمسيس تاني صاحبي بيت هاتي فردتك وتع ي,71
 بيكاتشو ,Bekatsho , بيكاتشو ,Marwan pablo, 2016,https://genius.com/Marwan-pablo-bekatsho-lyrics,https://images.genius.com/851c4fd260fad7b7e457e0f631ae84fd.1000x1000x1.png,Chorus ديناصور شارع ماشي بديناصور شارع سمعاتي فشخ مش سامع بكتبو ملوش نهاءي بعمل فقط دماغي I struma tals Verse 1 فرشه اسناني بتسوس زءبق ووشي مرايه مش طايقاني مجمل بتحاول تبقا مستر مش كارك حاول تموت افكارك بغمز بحر طحينه ناس تشوف فراسك كوكب بطيخه بتكعبل فطح مدهونه لون اخضر جمب وداني كتير دماغي اكتر فيلم رعب لذيذ زومبي بلياتشو موبايلي بيفصل شحن بسرعه بشحنو بيكاتشو Chorus ديناصور شارع ماشي بديناصور شارع سمعاتي فشخ مش سامع بكتبو ملوش نهاءي بعمل فقط دماغي,83
 بن لادن ,Bin Laden , بن لادن ,Marwan pablo,2016,https://genius.com/Marwan-pablo-bin-laden-lyrics,https://images.genius.com/851c4fd260fad7b7e457e0f631ae84fd.1000x1000x1.png, عايز يبقي مخ مخ محتاج دماغ جنب هنصب نار ونقوم نغير مناخ تاج فوق راسي بيستقر خلاصه كلام Beatبعمل Edit للراب Nigga سميني انستجرام She k ows im fucki g hot ومش محتاج كمادات ضهر بعض بقولك كس امان دنيا صعب اقتل امه اختشاش بطلع للسحاب اتاكد اسمي اختفاش لسه موت جاش لسه ضهري انحناش وعلي راي دريك حبوناش ولاد مره حبوناش چوب انتهاش باصي چوب انتهاش بتحس بايدي ماسكه ايديها حقيقه مستهاش Nigga im flyi g shit بنسطرش بنشد بنعمل نمر تكون بتعرف تعد اه اه شايف دنيا صفرا بًا بًا غرقان رمله مش كلام طول ساكت تحت عيني اسود اكني شاب فاقد بجري لعبه Im killi g shit Yeah مش كلام طول ساكت طول ساكت طول ساكت Yeah ذوي بارد مش بني ادم فبيفتكروني مارد مش كلام طول ساكت حافظ كلامهم بفضل طول ساكت يعرفني مش شايف يستاهل مش بني ادم بيفتكروني مارد,145
 برر برر برر ,Brrr Brrr Brrr , برر برر برر ,Marwan pablo, 2022,https://genius.com/Abo-el-anwar-brrr-brrr-brrr-lyrics,https://images.genius.com/d5feca72c35ebf4ba446592200adb4d9.1000x1000x1.png, برر برر برر برر برر برر برر برر برر برر برر جامد برر برر برر برر برر برر برر برر برر برر برر برر برر برر برر برر برر برر برر برر برر برر فاجر اسطي برر برر برر برر برر برر برر برر برر برر برر سكو سكو  ابو انوار اه كلام وايه نظام خبطت عربيه برجلي كسرت اكصدام باحترام اكصدام جاي كلمه صدام اصل تساءلات مش لاقيلها مسببات فوق Cat Hell مافيش صايع فشخ اسكيمات زميلي مات عامل حفله استاد هغني جول هغني جول وسانتا تنده Bu  يفرقليش سانده بشوط هيد هولندا Forever Waka da دنيا بتعاندك ففوق بقي بقي بقي بقي بقي بقي اوه اوه اوه بقي بقي بقي بقي بقي اوه اوه اوه اوه مجرب رد فعلي اتغاشم عندي عيب بتلغبط دايمًا هشام وهاشم حققت بطوله بطولي ولسه شاب ناشء هتلاقي حاجه مكسب ميمو راشق تحديداً هيتس ومزيكا بيت سيكا فلوهاتي جديده فبريكا بنتبل هات بابريكا اسطي امريكا Viral هن حارق اخصامي شيكا زميلي ويكا Week علم زميلي واوه اوه اوه اوه تقيل بيت مش ويني بوه بوه لابس شيك زميلي ولبسي بيقلدوه فانزي عودوني فانزه عوروه مج مايل وبابلو بنعدلوه اوه وكل ماننجح اخصام بتنبح وكل نلمع سكاكين تلمه وزي تيتو ظبطيتو ورد فعلي دايمًا بيبقي كلمه,202
 كنترول ,Ctrl , كنترول ,Marwan pablo, 2021,https://genius.com/Marwan-pablo-ctrl-lyrics,https://images.genius.com/30dfb242a46ca3d2eaaf852f86b36a2b.817x817x1.png, حاسب مسافه بثقش اغراب  اغراب Beat Beatبابلو بيكاسو  Ladies   Ladies Beat Beatاسكوبار اخصام اخصام مافيش حياتي شماعه شماعه مافيش للاعذار اعذار كهف بعيد انظار انظار بحط رجلي كار دوس بجري حياء رادار ياه جايبها ازميلي قولهم صعب تلاقيني اعوجها قولهم زمان كنا نلعب اساتك ياً بجيب بواكي واستكها استكها حياتي عامله فيلم قولهم فمش محتاج احبكها قولهم بشوط كارلوس شوط وانزه بيكهام ياه وصلت للقمه بفضل ربي  حمد لله اخدتش اختصار قولهم فرق باين فقعتوا بار قولهم يدسني وده ينكشني قولهم محافظ وقار قولهم اصلي مش لا ينفعش ابيف اطف قولهم قولهم Goku Super Saiya بفليكس عليكوا ليكرا اها Beat Beatهادي برضه Loco اها ولساني زفر عتره برررع وضعي وده فطره باقي عايشين كذبه بع بع ازميلي حضره احلي عزبه ياه مج مج مج مقلوب بيلت وده بيتكلم ب ب بادءها عت لحد بقيت معلم بع بع قولولهم نار تحرق يمسكها قولهم ور ور Beat Beatورده عليكوا وقدروا شغله بيتها ساقطه يا ساقطه نفسك انتِ لقطه في لقطه قولي ازاي ازاي وتخينكم مش حمل لطشه مش حمل لطشه فاطشه بفه زميلي فاطشه قولوا لاي شاب اصفر يريح يشد لحافه ويتغطي يتغطي يتغطي Beat Beatاما تيجي تركب  Wave تستاذن بدل اجي اربطك طوق لكمش عندي نعل جزمه صنف بيجيش ذوق بحرقهم نظره وتفه Beat Beatعلي مايك ب Spit بترول Beat Beatفي  Release دايماً بتاخر Beatبس تحت  Ctrl Beatبس تحت  Ctrl Beat Beatادوني سلاح وعدوا  Score راب عز نوم يقولي جدعان ايدينا اصاحبي مش ورطه تحزقش تموت اسطي واسطه نحتاجش لواسطه بمضيش خلاص سبت بصمه اه Beat Beatلو كلام مش Real لساني مش هينطق بيه خدي فيزا عبي بيها قلبي مش هتاخديه Beat Beat رقم مش مقامي فمضطر اكنسل  Deal لازم اعوض سهرتها وانتوا نايمين ياه,274
 سايفر المعادي ,Cypher El Maadi , سايفر المعادي ,Marwan pablo, 2019,https://genius.com/Ma3azef-cypher-el-maadi-lyrics,https://images.genius.com/6de432359c3538d7d0886946336bc4a1.1000x1000x1.png,  رابتورمقطع اغنيه رابتور مروان موسي بينا نبدا شاف هشام شعره شاب غاب برضه رابتور يعلي سمعنا تراك مارو انتاج مش مارو هشام خارج نطاق خدمه Stop سيس MCs طبطب  ترميم سين صاد صدمه بيتشعبط رابه استعبط واستعرض مش هعرف باشا Fake بطلوا خرا ل خرا بار خرم شاشه مقطع ثاني ابن حسني براب لحد اقطع بطلت اراب بسيب علامه مسجله بص فوق صوتي سما معدي بحر مش باخد سمك كتافي بنزل دماغ طريد فاكر سبق حسني هداف  طاسه لسه فرود اداء دكه بدلاء ودان سامم مج موديلات,87
 دايرة ع المصلحة ,Daira 3almasla7a , دايرة ع المصلحة ,Marwan pablo, 2018,https://genius.com/Wegz-daira-3almasla7a-lyrics,https://images.genius.com/3c7ab628dac7eee61275b6f5206cfdd3.1000x1000x1.png, مقدمه ويجز  oxx Yeah لازمه ويجز دايره مصلحه دايره مصلحه فاكر تقدر تاخد مني حاجه تبقي مجنون ع مصحه  ويجز تحت عشرين واديلك دروس حياه صاحبنا جناه وزملينا اشقيا بيعمل يتشاف ناس رياء تواجهم حصل يقولوا ابرياء ابرياء يقولوا ابرياء Wait كلميني اتناشر دنيا تروق كلميني اتناشر ضلمه تسود دريانين دنيا وعارفين اصول مشغل دماغ تيجي عندي تفوق كلنا ولاد ناس نزاهه نعاملوك واتربينا سوق وبرضه هنعمل فلوس هنعمل فلوس غلطاتك بتعلقها شماعه ظروف,74
